,subject,task,area,place,city,state,wage,company,url
99,Vaga de Desenvolvedor JAVA em Belém/PA,Desenvolvedor JAVA,Informática,Belém / PA,Belém,PA,a combinar,Avanti Telecom,https://www.bne.com.br/vaga-de-emprego-na-area-informatica-em-campo-mourao-pr/desenvolvedor-mobile/3335389
100,Vaga de Auxiliar de Informática em Curitiba/PR,Auxiliar de Informática,Outros,"Novo Mundo,  Curitiba / PR","Novo Mundo,  Curitiba",PR,"R$ 1.500,00 a R$ 1.800,00",Disk Ingressos - Ver dados da empresa,https://www.bne.com.br/vaga-de-emprego-na-area-informatica-em-belem-pa/desenvolvedor-java/3335365
101,Vaga de Auxiliar de Informática em Curitiba/PR,Auxiliar de Informática,Outros,Curitiba / PR,Curitiba,PR,a combinar,Nl Garcia,https://www.bne.com.br/vaga-de-emprego-na-area-informatica-em-curitiba-pr/auxiliar-de-informatica/3335335
102,Vaga de Desenvolvedor PHP em Novo Hamburgo/RS - home office,Desenvolvedor PHP,Outros,Novo Hamburgo / RS,Novo Hamburgo,RS,a combinar,Grupo Sinos,https://www.bne.com.br/vaga-de-emprego-na-area-informatica-em-curitiba-pr/auxiliar-de-informatica/3335324
103,Vaga de Analista de Banco de Dados em Pato Branco/PR,Analista de Banco de Dados,Outros,Pato Branco / PR,Pato Branco,PR,a combinar,Rhf Talentos,https://www.bne.com.br/vaga-de-emprego-na-area-informatica-em-novo-hamburgo-rs/desenvolvedor-php/3335281
104,Vaga de Desenvolvedor JAVA em Curitiba/PR,Desenvolvedor JAVA,Informática,"Fanny,  Curitiba / PR","Fanny,  Curitiba",PR,"R$ 3.000,00 a R$ 6.000,00",Confidencial O que é isso?,https://www.bne.com.br/vaga-de-emprego-na-area-informatica-em-pato-branco-pr/analista-de-banco-de-dados/3335263
105,Vaga de Programador em Curitiba/PR,Programador,Informática,Curitiba / PR,Curitiba,PR,a combinar,Mais Estágios,https://www.bne.com.br/vaga-de-emprego-na-area-informatica-em-curitiba-pr/desenvolvedor-java/3335244
106,Vaga de Desenvolvedor Mobile em Campo Mourão/PR,Desenvolvedor Mobile,Outros,Campo Mourão / PR,Campo Mourão,PR,"R$ 7.000,00 a R$ 10.000,00",TICOOP BRASIL - COOPERATIVA DOS PROFISSIONAIS EM TECNOLOGIA DA INFORMACAO - Ver dados da empresa,https://www.bne.com.br/vaga-de-emprego-na-area-informatica-em-curitiba-pr/programador/3335237
107,Vaga de Assistente de Ti em Porto Alegre/RS - home office,Assistente de Ti,Outros,Porto Alegre / RS,Porto Alegre,RS,a combinar,False,https://www.bne.com.br/vaga-de-emprego-na-area-informatica-em-campo-mourao-pr/desenvolvedor-mobile/3335097
108,Vaga de Agente de Suporte em Porto Alegre/RS - home office,Agente de Suporte,Outros,Porto Alegre / RS,Porto Alegre,RS,a combinar,False,https://www.bne.com.br/vaga-de-emprego-na-area-informatica-em-porto-alegre-rs/assistente-de-ti/3334982
109,Vaga de Desenvolvedor em Balneário Camboriú/SC - home office,Desenvolvedor,Informática,Balneário Camboriú / SC,Balneário Camboriú,SC,a combinar,Concentrei,https://www.bne.com.br/vaga-de-emprego-na-area-informatica-em-porto-alegre-rs/agente-de-suporte/3334951
110,Vaga de Operador de Ti em Niterói/RJ - home office,Operador de Ti,Outros,Niterói / RJ,Niterói,RJ,a combinar,Confidencial O que é isso?,https://www.bne.com.br/vaga-de-emprego-na-area-informatica-em-balneario-camboriu-sc/desenvolvedor/3334831
111,Vaga de Auxiliar de TI em Rio de Janeiro/RJ - home office,Auxiliar de TI,Outros,Rio de Janeiro / RJ,Rio de Janeiro,RJ,a combinar,Confidencial O que é isso?,https://www.bne.com.br/vaga-de-emprego-na-area-informatica-em-niteroi-rj/operador-de-ti/3334752
112,Vaga de Assistente de Sistemas em São Bernardo do Campo/SP - home office,Assistente de Sistemas,Outros,São Bernardo do Campo / SP,São Bernardo do Campo,SP,a combinar,invent.eng,https://www.bne.com.br/vaga-de-emprego-na-area-informatica-em-rio-de-janeiro-rj/auxiliar-de-ti/3334718
113,Vaga de Programador em Aparecida de Goiânia/GO - home office,Programador,Informática,Aparecida de Goiânia / GO,Aparecida de Goiânia,GO,a combinar,a3consultoria,https://www.bne.com.br/vaga-de-emprego-na-area-informatica-em-sao-bernardo-do-campo-sp/assistente-de-sistemas/3334615
114,Vaga de Desenvolvedor em Curitiba/PR - home office,Desenvolvedor,Informática,Curitiba / PR,Curitiba,PR,a combinar,Confidencial O que é isso?,https://www.bne.com.br/vaga-de-emprego-na-area-informatica-em-aparecida-de-goiania-go/programador/3334676
115,Vaga de Assistente de Suporte Técnico em Cornélio Procópio/PR,Assistente de Suporte Técnico,Outros,Cornélio Procópio / PR,Cornélio Procópio,PR,a combinar,Faccrei,https://www.bne.com.br/vaga-de-emprego-na-area-informatica-em-curitiba-pr/desenvolvedor/3334658
116,Vaga de Analista de TI em Colombo/PR,Analista de TI,Outros,"RINCÃO,  Colombo / PR","RINCÃO,  Colombo",PR,"R$ 3.000,00 a R$ 3.500,00",PR GRUPOPARANA - Ver dados da empresa,https://www.bne.com.br/vaga-de-emprego-na-area-informatica-em-cornelio-procopio-pr/assistente-de-suporte-tecnico/3334575
117,Vaga de Analista de Projetos em Curitiba/PR,Analista de Projetos,Outros,Curitiba / PR,Curitiba,PR,"R$ 4.000,00 a R$ 5.000,00",Accade Capital Humano - Ver dados da empresa,https://www.bne.com.br/vaga-de-emprego-na-area-informatica-em-colombo-pr/analista-de-ti/3334534
118,Vaga de Desenvolvedor Frontend em São Paulo/SP - home office,Desenvolvedor Frontend,Outros,São Paulo / SP,São Paulo,SP,a combinar,Pasquali Solution,https://www.bne.com.br/vaga-de-emprego-na-area-informatica-em-curitiba-pr/analista-de-projetos/3334509
119,Vaga de Analista de Infraestrutura em Goiânia/GO,Analista de Infraestrutura,Outros,Goiânia / GO,Goiânia,GO,a combinar,Open,https://www.bne.com.br/vaga-de-emprego-na-area-informatica-em-sao-paulo-sp/desenvolvedor-frontend/3334479
120,Vaga de Coordenador de Suporte Técnico em Goiânia/GO,Coordenador de Suporte Técnico,Outros,Goiânia / GO,Goiânia,GO,a combinar,Open,https://www.bne.com.br/vaga-de-emprego-na-area-informatica-em-goiania-go/analista-de-infraestrutura/3334478
121,Vaga de Técnico de Informática em Uberlândia/MG,Técnico de Informática,Outros,Uberlândia / MG,Uberlândia,MG,a combinar,Tecnoanjos,https://www.bne.com.br/vaga-de-emprego-na-area-informatica-em-goiania-go/coordenador-de-suporte-tecnico/3334461
122,Vaga de Assistente de Ti em Navegantes/SC,Assistente de Ti,Outros,Navegantes / SC,Navegantes,SC,a combinar,Empregos Vale do Itajai,https://www.bne.com.br/vaga-de-emprego-na-area-informatica-em-uberlandia-mg/tecnico-de-informatica/3334447
123,Vaga de Consultor de Implantação em Curitiba/PR,Consultor de Implantação,Outros,"Bacacheri,  Curitiba / PR","Bacacheri,  Curitiba",PR,"R$ 1.500,00 a R$ 2.000,00",FALAVINHA NEXT - Ver dados da empresa,https://www.bne.com.br/vaga-de-emprego-na-area-informatica-em-navegantes-sc/assistente-de-ti/3334370
124,Vaga de Assistente de Recursos Humanos em Curitiba/PR,Assistente de Recursos Humanos,Outros,"Orleans,  Curitiba / PR","Orleans,  Curitiba",PR,"R$ 2.000,00 a R$ 2.300,00",Agnes Trabalho Temporário Ltda - Ver dados da empresa,https://www.bne.com.br/vaga-de-emprego-na-area-informatica-em-curitiba-pr/consultor-de-implantacao/3334304
125,Vaga de Analista de DP em Goiânia/GO,Analista de DP,Outros,Goiânia / GO,Goiânia,GO,a combinar,Recrutar Consultoria,https://www.bne.com.br/vaga-de-emprego-na-area-recursos-humanos-em-curitiba-pr/assistente-de-recursos-humanos/3335604
126,Vaga de Auxiliar de Recursos Humanos em Morro da Fumaça/SC,Auxiliar de Recursos Humanos,Outros,Morro da Fumaça / SC,Morro da Fumaça,SC,a combinar,Athens,https://www.bne.com.br/vaga-de-emprego-na-area-recursos-humanos-em-goiania-go/analista-de-dp/3335591
127,Vaga de Assistente de Departamento Pessoal em Maringá/PR,Assistente de Departamento Pessoal,Recursos Humanos,Maringá / PR,Maringá,PR,a combinar,Drugovich Auto Peças,https://www.bne.com.br/vaga-de-emprego-na-area-recursos-humanos-em-morro-da-fumaca-sc/auxiliar-de-recursos-humanos/3335587
128,Vaga de Auxiliar de DP em Pinhais/PR,Auxiliar de DP,Outros,"CENTRO,  Pinhais / PR","CENTRO,  Pinhais",PR,"R$ 1.800,00 a R$ 1.900,00",Confidencial O que é isso?,https://www.bne.com.br/vaga-de-emprego-na-area-recursos-humanos-em-maringa-pr/assistente-de-departamento-pessoal/3335568
129,Vaga de Auxiliar de RH em Curitiba/PR,Auxiliar de RH,Outros,"MERCÊS,  Curitiba / PR","MERCÊS,  Curitiba",PR,"R$ 1.200,00 a R$ 1.500,00",Sétima Serviços - Ver dados da empresa,https://www.bne.com.br/vaga-de-emprego-na-area-recursos-humanos-em-pinhais-pr/auxiliar-de-dp/3335490
130,Vaga de Analista de Recrutamento e Seleção em Belo Horizonte/MG - home office,Analista de Recrutamento e Seleção,Outros,Belo Horizonte / MG,Belo Horizonte,MG,a combinar,Bennu Consultoria,https://www.bne.com.br/vaga-de-emprego-na-area-recursos-humanos-em-curitiba-pr/auxiliar-de-rh/3335454
131,Vaga de Analista de Recrutamento e Seleção em São José dos Pinhais/PR,Analista de Recrutamento e Seleção,Outros,São José dos Pinhais / PR,São José dos Pinhais,PR,"R$ 2.000,00 a R$ 3.000,00",Confidencial O que é isso?,https://www.bne.com.br/vaga-de-emprego-na-area-recursos-humanos-em-belo-horizonte-mg/analista-de-recrutamento-e-selecao/3335444
132,Vaga de Assistente de Recursos Humanos em Ferraz de Vasconcelos/SP,Assistente de Recursos Humanos,Outros,Ferraz de Vasconcelos / SP,Ferraz de Vasconcelos,SP,"R$ 2.000,00 a R$ 3.000,00",Confidencial O que é isso?,https://www.bne.com.br/vaga-de-emprego-na-area-recursos-humanos-em-sao-jose-dos-pinhais-pr/analista-de-recrutamento-e-selecao/3335435
133,Vaga de Coordenador de RH em Belo Horizonte/MG,Coordenador de RH,Outros,Belo Horizonte / MG,Belo Horizonte,MG,a combinar,Hofbraühaus,https://www.bne.com.br/vaga-de-emprego-na-area-recursos-humanos-em-ferraz-de-vasconcelos-sp/assistente-de-recursos-humanos/3331087
134,Vaga de Auxiliar de DP em Cotia/SP - home office,Auxiliar de DP,Outros,Cotia / SP,Cotia,SP,a combinar,False,https://www.bne.com.br/vaga-de-emprego-na-area-recursos-humanos-em-belo-horizonte-mg/coordenador-de-rh/3335350
135,Vaga de Assistente de DP em Belo Horizonte/MG - home office,Assistente de DP,Outros,Belo Horizonte / MG,Belo Horizonte,MG,a combinar,False,https://www.bne.com.br/vaga-de-emprego-na-area-recursos-humanos-em-cotia-sp/auxiliar-de-dp/3335025
136,Vaga de Assistente de Departamento Pessoal em Porto Alegre/RS - home office,Assistente de Departamento Pessoal,Recursos Humanos,Porto Alegre / RS,Porto Alegre,RS,a combinar,False,https://www.bne.com.br/vaga-de-emprego-na-area-recursos-humanos-em-belo-horizonte-mg/assistente-de-dp/3334985
137,Vaga de Analista de DP em Belo Horizonte/MG - home office,Analista de DP,Outros,Belo Horizonte / MG,Belo Horizonte,MG,a combinar,False,https://www.bne.com.br/vaga-de-emprego-na-area-recursos-humanos-em-porto-alegre-rs/assistente-de-departamento-pessoal/3334986
138,Vaga de Encarregado de Recursos Humanos em Porto Alegre/RS - home office,Encarregado de Recursos Humanos,Outros,Porto Alegre / RS,Porto Alegre,RS,a combinar,False,https://www.bne.com.br/vaga-de-emprego-na-area-recursos-humanos-em-belo-horizonte-mg/analista-de-dp/3334967
139,Vaga de Auxiliar de Departamento Pessoal em Brasília/DF - home office,Auxiliar de Departamento Pessoal,Recursos Humanos,Brasília / DF,Brasília,DF,a combinar,Confidencial O que é isso?,https://www.bne.com.br/vaga-de-emprego-na-area-recursos-humanos-em-porto-alegre-rs/encarregado-de-recursos-humanos/3334949
140,Vaga de Auxiliar de Departamento Pessoal em Brasília/DF - home office,Auxiliar de Departamento Pessoal,Recursos Humanos,Brasília / DF,Brasília,DF,a combinar,cscdf,https://www.bne.com.br/vaga-de-emprego-na-area-recursos-humanos-em-brasilia-df/auxiliar-de-departamento-pessoal/3334913
141,Vaga de Assistente de Departamento Pessoal em Rio de Janeiro/RJ - home office,Assistente de Departamento Pessoal,Recursos Humanos,Rio de Janeiro / RJ,Rio de Janeiro,RJ,a combinar,bps4,https://www.bne.com.br/vaga-de-emprego-na-area-recursos-humanos-em-brasilia-df/auxiliar-de-departamento-pessoal/3334911
142,Vaga de Assistente de RH em Manaus/AM - home office,Assistente de RH,Recursos Humanos,Manaus / AM,Manaus,AM,a combinar,Confidencial O que é isso?,https://www.bne.com.br/vaga-de-emprego-na-area-recursos-humanos-em-rio-de-janeiro-rj/assistente-de-departamento-pessoal/3334758
143,Vaga de Analista de DP em Rio de Janeiro/RJ - home office,Analista de DP,Outros,Rio de Janeiro / RJ,Rio de Janeiro,RJ,a combinar,nomoo,https://www.bne.com.br/vaga-de-emprego-na-area-recursos-humanos-em-manaus-am/assistente-de-rh/3334749
144,Vaga de Auxiliar de DP em Curitiba/PR,Auxiliar de DP,Outros,"Centro,  Curitiba / PR","Centro,  Curitiba",PR,"R$ 1.045,00 a R$ 1.600,00",Aline Otto - Ver dados da empresa,https://www.bne.com.br/vaga-de-emprego-na-area-recursos-humanos-em-rio-de-janeiro-rj/analista-de-dp/3334737
145,Vaga de Analista de DP em Florianópolis/SC,Analista de DP,Outros,Florianópolis / SC,Florianópolis,SC,a combinar,Rg Contadores Associados,https://www.bne.com.br/vaga-de-emprego-na-area-recursos-humanos-em-curitiba-pr/auxiliar-de-dp/3330795
146,Vaga de Assistente de DP em Registro/SP - home office,Assistente de DP,Outros,Registro / SP,Registro,SP,a combinar,asv,https://www.bne.com.br/vaga-de-emprego-na-area-recursos-humanos-em-florianopolis-sc/analista-de-dp/3335231
147,Vaga de Assistente de Departamento Pessoal em São Paulo/SP - home office,Assistente de Departamento Pessoal,Recursos Humanos,São Paulo / SP,São Paulo,SP,a combinar,False,https://www.bne.com.br/vaga-de-emprego-na-area-recursos-humanos-em-registro-sp/assistente-de-dp/3335190
148,Vaga de Analista de Recursos Humanos em Campinas/SP - home office,Analista de Recursos Humanos,Outros,Campinas / SP,Campinas,SP,a combinar,False,https://www.bne.com.br/vaga-de-emprego-na-area-recursos-humanos-em-sao-paulo-sp/assistente-de-departamento-pessoal/3335122
149,Vaga de Analista de DP em Porto Alegre/RS - home office,Analista de DP,Outros,Porto Alegre / RS,Porto Alegre,RS,a combinar,False,https://www.bne.com.br/vaga-de-emprego-na-area-recursos-humanos-em-campinas-sp/analista-de-recursos-humanos/3335116
150,Vaga de Assistente de Recursos Humanos em Ferraz de Vasconcelos/SP - home office,Assistente de Recursos Humanos,Outros,Ferraz de Vasconcelos / SP,Ferraz de Vasconcelos,SP,a combinar,False,https://www.bne.com.br/vaga-de-emprego-na-area-recursos-humanos-em-porto-alegre-rs/analista-de-dp/3335107
151,Vaga de Auxiliar de Recursos Humanos em Chapecó/SC - home office,Auxiliar de Recursos Humanos,Outros,Chapecó / SC,Chapecó,SC,a combinar,False,https://www.bne.com.br/vaga-de-emprego-na-area-recursos-humanos-em-ferraz-de-vasconcelos-sp/assistente-de-recursos-humanos/3335100
152,Vaga de Analista de Desenvolvimento Organizacional em São José dos Campos/SP - home office,Analista de Desenvolvimento Organizacional,Outros,São José dos Campos / SP,São José dos Campos,SP,a combinar,False,https://www.bne.com.br/vaga-de-emprego-na-area-recursos-humanos-em-chapeco-sc/auxiliar-de-recursos-humanos/3335082
153,Vaga de Assistente de Recursos Humanos em Suzano/SP - home office,Assistente de Recursos Humanos,Outros,Suzano / SP,Suzano,SP,a combinar,False,https://www.bne.com.br/vaga-de-emprego-na-area-recursos-humanos-em-sao-jose-dos-campos-sp/analista-de-desenvolvimento-organizacional/3335066
